<Payload xmlns="http://javaops.ru"
         xmlns:xsi="http://www.w3.org/2001/XMLSchema-instance"
         xsi:schemaLocation="http://javaops.ru payload.xsd">
    <Users>
        <User flag="active" city="kiv" email="gmail@gmail.com">
            <fullName>Full Name</fullName>
        </User>
        <User flag="superuser" city="spb" email="admin@javaops.ru">
            <fullName>Admin</fullName>
        </User>
        <User flag="deleted" city="spb" email="mail@yandex.ru">
            <fullName>Deleted</fullName>
        </User>
    </Users>
    <Groups>
        <Group id="masterjava01" project="mj" type="CURRENT"/>
    </Groups>
    <Cities>
        <City id="spb">Санкт-Петербург</City>
        <City id="kiv">Киев</City>
        <City id="mnsk">Минск</City>
    </Cities>
    <Projects>
        <Project id="mj" description="masterjava description">masterjava</Project>
        <Project id="tj" description="topjava description">topjava</Project>
    </Projects>
</Payload>